is_offensive,text
0,ጣልያን ሃገሬን የሚገዛው እኔ ሮምን ስገዛ ነው::
1,ከንፈርሽ ሜቴክ ነው መስረቅ የለመደ እግርሽ አብይ ነው መሄድ የወደደ ጡትሽ ሀይለማርያም በራሱ የወረደ ገላሽ ሙፈሪያት እሺን የለመደ ቋንቋሽ ውጪ ጉዳይ የተወላገደ እረ እንዴት ልቀፍሽ ውስጤኮ ነደደ:: *** አመሰግናለው ጥበብ
0,ከቤቱ ውሀ በጀሪካን ሞልቶ ችግኝ የሚያጠጣ ኢትዮጵያዊ! እንዲህ አይነቱን በጎ ተግባር ሳይ ኢትዮጵያ ብትቀጥንም የማትበጠስ፣የደከመች ብትመስልም የማትሞት ሆና ይሰማኛል።
0,የ 600 ብር ዶሮ በ 4 ብር እንጀራ መብላት የዶሮን ሰብአዊ  መብት መጋፋት አይሆንም ??!
0,"በፊት ከአሠፓ ም/ቤት ወይም ከኢህአዴግ ጽ/ቤት ይገኝ የነበረው ስልጣን አሁን የሚገኘው ማኀበራዊ ሚዲያን እንደመሳሪያ ከሚጠቀም ሞብ ነው።" ታምራት ገብረጊዮርጊስ በኤፍኢኤስ የውይይት መድረክ ላይ የተናገሩት።
0,''ኢትዮጵያዊነትን በሌላ ባዕድ ማንነት ቅርፅ ማስያዝ ጣልያንና አውሮፓም አልተሳካላትም:: የአድዋ ታሪክ ይደገማል የምንደግመው ፀረ ኢትዮጵያውያንን በመርታት ነው ኢትዮጵያ ስንል ውሸት እና ማስመሰል የሌለባታን ጥንታዊቷን ኢትዮጵያ ነው''